{
  "$schema": "https://json-schema.org/draft/2020-12/schema",
  "$id": "https://github.com/ech09527/quant-factors/schemas/evaluation-schema.json",
  "title": "FactorEvaluation",
  "description": "因子评估结果（确定性引擎输出）",
  "type": "object",
  "required": [
    "status",
    "title",
    "title_hash",
    "formula_hash",
    "expression_version",
    "engine_version",
    "metrics_version",
    "evaluation_type",
    "evaluated_at",
    "data_range",
    "factor_sql",
    "metrics"
  ],
  "additionalProperties": false,
  "properties": {
    "status": {
      "type": "string",
      "enum": ["success", "failed", "skipped"]
    },
    "title": { "type": "string" },
    "title_hash": { "type": "string", "pattern": "^[a-f0-9]{64}$" },
    "formula_hash": { "type": "string", "pattern": "^[a-f0-9]{64}$" },
    "expression_version": { "type": "string" },
    "engine_version": { "type": "string" },
    "metrics_version": { "type": "string" },
    "evaluation_type": {
      "type": "string",
      "enum": ["cross_sectional", "time_series"]
    },
    "validation_profile_key": {
      "type": "string",
      "description": "验证配置 key，如 fwd_ret_1 / fwd_vol_24"
    },
    "neutralization_key": {
      "type": "string",
      "description": "中性化配置 key，如 none / liq_mom / auto / 指纹"
    },
    "neutralization_spec": {
      "type": "object",
      "description": "中性化规格（exposures 配置），优先于仅用 key 解析"
    },
    "evaluated_at": { "type": "string", "format": "date-time" },
    "skipped_reason": { "type": "string" },
    "data_range": {
      "type": "object",
      "required": ["start", "end", "n_bars"],
      "additionalProperties": false,
      "properties": {
        "start": { "type": "string" },
        "end": { "type": "string" },
        "n_bars": { "type": "integer", "minimum": 0 }
      }
    },
    "factor_sql": {
      "type": "object",
      "required": [
        "version",
        "dialect",
        "evaluation_type",
        "data_source",
        "signal_sql",
        "postprocess",
        "universe"
      ]
    },
    "metrics": {
      "type": "object",
      "required": [
        "mean_ic",
        "ic_ir",
        "mean_rank_ic",
        "rank_ic_ir",
        "n_periods",
        "ic_positive_ratio"
      ],
      "additionalProperties": false,
      "properties": {
        "mean_ic": { "type": "number" },
        "ic_ir": { "type": ["number", "null"] },
        "mean_rank_ic": { "type": "number" },
        "rank_ic_ir": { "type": ["number", "null"] },
        "n_periods": { "type": "integer", "minimum": 0 },
        "ic_positive_ratio": { "type": "number", "minimum": 0, "maximum": 1 },
        "validation_profile_key": { "type": "string" },
        "neutralization_key": { "type": "string" },
        "label_kind": { "type": "string" },
        "horizon_bars": { "type": "integer", "minimum": 1 }
      }
    },
    "diagnostics": {
      "type": "object",
      "additionalProperties": true
    },
    "ic_series": {
      "type": "object",
      "description": "逐期 IC / Rank IC 序列（写入 MLflow artifact）",
      "additionalProperties": true
    }
  }
}
