{
  "status": "success",
  "title": "Alpha158-ROC30",
  "title_hash": "77cbe64c27ad8d2653e16ff2cd2cde612cd43a64de617bab01423faeadaae519",
  "formula_hash": "67570afde785754f8256157a4ec4130cf7df7b2f68cb9363d11a939b5efde416",
  "expression_version": "1",
  "engine_version": "0.1.0",
  "metrics_version": "0.1.0",
  "evaluation_type": "cross_sectional",
  "evaluated_at": "2026-06-30T02:41:52.090845+00:00",
  "data_range": {
    "start": "2023-01-01",
    "end": "2026-05-31",
    "n_bars": 6569119
  },
  "factor_sql": {
    "version": "1",
    "dialect": "duckdb-factor-v1",
    "evaluation_type": "cross_sectional",
    "data_source": "yhydev97/quant-data",
    "signal_sql": "LAG(close, 30) OVER w / close",
    "postprocess": "cs_rank",
    "universe": {
      "dropna": [
        "open",
        "high",
        "low",
        "close"
      ],
      "min_symbol_bars": 168,
      "cs_quantile_gte": {
        "col": "quote_volume",
        "q": 0.2
      }
    }
  },
  "metrics": {
    "mean_ic": 0.00432156110219795,
    "ic_ir": 0.03230043970012184,
    "mean_rank_ic": 0.02210442578764909,
    "rank_ic_ir": 0.15817780666921966,
    "n_periods": 29896,
    "ic_positive_ratio": 0.5109044688252609
  },
  "diagnostics": {
    "skipped_periods_low_n": 1,
    "avg_universe_size": 219.48731914324858
  }
}
