{
  "status": "success",
  "title": "横截面主动买卖成交均价差轮动",
  "title_hash": "a8285830c833806215fc4b5e21d48ffb16baa7d9c9bddfb2c4059af6ae813156",
  "formula_hash": "97380939a4c8b832355b81b29c69b0c7da5995a0b48ea20afeddaafc61d94c26",
  "expression_version": "1",
  "engine_version": "0.1.0",
  "metrics_version": "0.1.0",
  "evaluation_type": "cross_sectional",
  "evaluated_at": "2026-06-29T13:35:37.476640+00:00",
  "data_range": {
    "start": "2023-01-01",
    "end": "2026-05-31",
    "n_bars": 6569119
  },
  "factor_sql": {
    "version": "1",
    "dialect": "duckdb-factor-v1",
    "evaluation_type": "cross_sectional",
    "data_source": "yhydev97/quant-data",
    "signal_sql": "CASE WHEN taker_buy_volume / (volume + 1e-8) >= 0.05 AND (volume - taker_buy_volume) / (volume + 1e-8) >= 0.05 THEN (taker_buy_quote_volume / (taker_buy_volume + 1e-8) - (quote_volume - taker_buy_quote_volume) / (volume - taker_buy_volume + 1e-8)) / (((high + low) / 2) + 1e-8) ELSE NULL END",
    "postprocess": "cs_rank",
    "universe": {
      "dropna": [
        "open",
        "high",
        "low",
        "close",
        "volume",
        "quote_volume",
        "taker_buy_volume",
        "taker_buy_quote_volume"
      ],
      "min_symbol_bars": 168,
      "cs_quantile_gte": {
        "col": "quote_volume",
        "q": 0.2
      }
    }
  },
  "metrics": {
    "mean_ic": 0.001179973486451597,
    "ic_ir": 0.011777565457041976,
    "mean_rank_ic": -0.0037983520663894903,
    "rank_ic_ir": -0.037771920698348914,
    "n_periods": 29925,
    "ic_positive_ratio": 0.5083040935672515
  },
  "diagnostics": {
    "skipped_periods_low_n": 1,
    "avg_universe_size": 219.48731914324858
  }
}
