{
  "status": "success",
  "title": "Alpha158-MA10",
  "title_hash": "49fed51f3cc199d44c61932c71c39d36f9636e41795aeb9f04444091475faa90",
  "formula_hash": "0d8352b74b5ded31c7457fcf40df69a2cfc4b7364af2a5abae48c84484fb11d4",
  "expression_version": "1",
  "engine_version": "0.1.0",
  "metrics_version": "0.1.0",
  "evaluation_type": "cross_sectional",
  "evaluated_at": "2026-06-30T02:49:40.089158+00:00",
  "data_range": {
    "start": "2023-01-01",
    "end": "2026-05-31",
    "n_bars": 6569119
  },
  "factor_sql": {
    "version": "1",
    "dialect": "duckdb-factor-v1",
    "evaluation_type": "cross_sectional",
    "data_source": "yhydev97/quant-data",
    "signal_sql": "AVG(close) OVER (w ROWS BETWEEN 9 PRECEDING AND CURRENT ROW) / close",
    "postprocess": "cs_rank",
    "universe": {
      "dropna": [
        "open",
        "high",
        "low",
        "close"
      ],
      "min_symbol_bars": 168,
      "cs_quantile_gte": {
        "col": "quote_volume",
        "q": 0.2
      }
    }
  },
  "metrics": {
    "mean_ic": 0.010733001468060605,
    "ic_ir": 0.07904604541558877,
    "mean_rank_ic": 0.03831969938050757,
    "rank_ic_ir": 0.2699424761264353,
    "n_periods": 29925,
    "ic_positive_ratio": 0.521203007518797
  },
  "diagnostics": {
    "skipped_periods_low_n": 1,
    "avg_universe_size": 219.48731914324858
  }
}
