{
  "status": "success",
  "title": "笔数激增价平吸筹",
  "title_hash": "834b6c6b8edef41d064f164562054fb64eb7799552804a426eeadaddc298e889",
  "formula_hash": "96db5c47f0e9a4b638c7236acff951eb031f55144628e714f454675a429dc55c",
  "expression_version": "1",
  "engine_version": "0.1.0",
  "metrics_version": "0.1.0",
  "evaluation_type": "cross_sectional",
  "evaluated_at": "2026-06-29T13:48:10.164512+00:00",
  "data_range": {
    "start": "2023-01-01",
    "end": "2026-05-31",
    "n_bars": 6569119
  },
  "factor_sql": {
    "version": "1",
    "dialect": "duckdb-factor-v1",
    "evaluation_type": "cross_sectional",
    "data_source": "yhydev97/quant-data",
    "signal_sql": "((count - AVG(count) OVER (w ROWS BETWEEN 23 PRECEDING AND CURRENT ROW)) / (STDDEV_SAMP(count) OVER (w ROWS BETWEEN 23 PRECEDING AND CURRENT ROW) + 1e-8)) * CASE WHEN ABS(log_ret_1) < QUANTILE_CONT(ABS(log_ret_1), 0.2) OVER (w ROWS BETWEEN 23 PRECEDING AND CURRENT ROW) THEN 1.0 ELSE 0.0 END * SIGN(taker_buy_volume / (volume + 1e-8) - 0.5)",
    "postprocess": "cs_rank",
    "universe": {
      "dropna": [
        "open",
        "high",
        "low",
        "close",
        "volume",
        "count",
        "taker_buy_volume"
      ],
      "min_symbol_bars": 168,
      "cs_quantile_gte": {
        "col": "quote_volume",
        "q": 0.2
      }
    }
  },
  "metrics": {
    "mean_ic": -0.0003128870295046277,
    "ic_ir": -0.0036773319051383803,
    "mean_rank_ic": 9.2227926375351e-05,
    "rank_ic_ir": 0.0011524442079154868,
    "n_periods": 29668,
    "ic_positive_ratio": 0.48493326142645277
  },
  "diagnostics": {
    "skipped_periods_low_n": 1,
    "avg_universe_size": 219.48731914324858
  }
}
