{
  "status": "success",
  "title": "Alpha158-RSQR5",
  "title_hash": "70363ac0bfb4bbdf28bd3a6ea43da66d738c246701e8947b8d7eaa6f4f0071b0",
  "formula_hash": "1c03f2c2129908c36d43953775797ab8ff1965294b46c7d6d1c5079e0adc046e",
  "expression_version": "1",
  "engine_version": "0.1.0",
  "metrics_version": "0.1.0",
  "evaluation_type": "cross_sectional",
  "evaluated_at": "2026-06-30T03:35:08.079106+00:00",
  "data_range": {
    "start": "2023-01-01",
    "end": "2026-05-31",
    "n_bars": 6569119
  },
  "factor_sql": {
    "version": "1",
    "dialect": "duckdb-factor-v1",
    "evaluation_type": "cross_sectional",
    "data_source": "yhydev97/quant-data",
    "signal_sql": "POWER(-10.0 * LAG(close, 4) OVER w - 5.0 * LAG(close, 3) OVER w + 5.0 * LAG(close, 1) OVER w + 10.0 * close, 2) / (50.0 * (5.0 * (POWER(LAG(close, 4) OVER w, 2) + POWER(LAG(close, 3) OVER w, 2) + POWER(LAG(close, 2) OVER w, 2) + POWER(LAG(close, 1) OVER w, 2) + POWER(close, 2)) - POWER(LAG(close, 4) OVER w + LAG(close, 3) OVER w + LAG(close, 2) OVER w + LAG(close, 1) OVER w + close, 2)) + 1e-8)",
    "postprocess": "cs_rank",
    "universe": {
      "dropna": [
        "open",
        "high",
        "low",
        "close"
      ],
      "min_symbol_bars": 168,
      "cs_quantile_gte": {
        "col": "quote_volume",
        "q": 0.2
      }
    }
  },
  "metrics": {
    "mean_ic": 0.0014166270612561039,
    "ic_ir": 0.014670894104931661,
    "mean_rank_ic": -0.00012489457185931895,
    "rank_ic_ir": -0.001221536720654232,
    "n_periods": 29922,
    "ic_positive_ratio": 0.5081879553505781
  },
  "diagnostics": {
    "skipped_periods_low_n": 1,
    "avg_universe_size": 219.48731914324858
  }
}
