{
  "status": "success",
  "title": "横截面主动买入基量-Quote占比裂口轮动",
  "title_hash": "e54d8c014392aabee892617b0741568dcfb76376ef2141e11e773ec31a37db0e",
  "formula_hash": "450b303539a0f1496edb7ef263b76a6e53d4f9039aa3bebd98c709207fac283b",
  "expression_version": "1",
  "engine_version": "0.1.0",
  "metrics_version": "0.1.0",
  "evaluation_type": "cross_sectional",
  "evaluated_at": "2026-06-29T14:30:35.522226+00:00",
  "data_range": {
    "start": "2023-01-01",
    "end": "2026-05-31",
    "n_bars": 6569119
  },
  "factor_sql": {
    "version": "1",
    "dialect": "duckdb-factor-v1",
    "evaluation_type": "cross_sectional",
    "data_source": "yhydev97/quant-data",
    "signal_sql": "(taker_buy_volume / NULLIF(volume, 0)) - (taker_buy_quote_volume / NULLIF(quote_volume, 0))",
    "postprocess": "cs_rank",
    "universe": {
      "dropna": [
        "open",
        "high",
        "low",
        "close"
      ],
      "min_symbol_bars": 168,
      "cs_quantile_gte": {
        "col": "quote_volume",
        "q": 0.2
      }
    }
  },
  "metrics": {
    "mean_ic": -0.0011625978592735573,
    "ic_ir": -0.01158305980813346,
    "mean_rank_ic": 0.003933539792301294,
    "rank_ic_ir": 0.039051311357632824,
    "n_periods": 29925,
    "ic_positive_ratio": 0.49126148705096073
  },
  "diagnostics": {
    "skipped_periods_low_n": 1,
    "avg_universe_size": 219.48731914324858
  }
}
